B3: Objective | E3: Timeframe | G3: Days | H3: Resources
B4: Module interaction specification | E4: begin | F4: 38076 | H4: All Members
B5: development | E5: Due | F5: =F4+G5 -> 38090 | G5: 14
B7: Server Setup | E7: begin | F7: 38083 | H7: Mike
E8: Due | F8: =F7+G8 -> 38090 | G8: 7
B10: PHP familiarity | E10: begin | F10: 38090 | H10: All members
B11: education | E11: Due | F11: =F10+G11 -> 38097 | G11: 7
B13: Coding | E13: begin | F13: 38090 | H13: Gary, Glenn, Matt, Larry
E14: Due | F14: =F13+G14 -> 38104 | G14: 14
B16: Testing | E16: begin | F16: 38104 | H16: All members
E17: Due | F17: =F16+G17 -> 38118 | G17: 14
B19: Module integration | E19: begin | F19: 38118 | H19: All members
E20: Due | F20: =F19+G20 -> 38132 | G20: 14
B22: Beta Testing with sponsors | E22: begin | F22: 38132 | H22: All members and sponsors
E23: Due | F23: =F22+G23 -> 38146 | G23: 14
B25: Presentation | E25: begin | F25: 38146 | H25: All members
E26: Due | F26: =F25+G26 -> 38146 | G26: 0